{
  "action_label": "halt_programme",
  "claims": [
    {
      "claim_id": "claim-7d528a63298265b2",
      "text": "Field 'context_tags' has value ['diagnostic-ai', 'radiology', 'adversarial', 'safety-critical'] (sourced from finding find-robust-001 via rule rule-robust-exec-001).",
      "trace": {
        "applied_rule_id": "rule-robust-exec-001",
        "applied_rule_version": "1.0.0",
        "claim_id": "claim-7d528a63298265b2",
        "context_pack_id": "ctx-health-001",
        "context_pack_version": "1.0",
        "passport_version": "v2a93800ba119bbfe",
        "role_id": "executive",
        "source_finding_id": "find-robust-001",
        "source_hash": "b7e2f4a1c9d3e5f6",
        "source_method": "projected-gradient adversarial evaluation",
        "source_timestamp": "2025-04-01T08:00:00Z"
      },
      "visible_fields_used": [
        "context_tags"
      ]
    },
    {
      "claim_id": "claim-954e7456d5577e85",
      "text": "Field 'finding_family' has value 'robustness' (sourced from finding find-robust-001 via rule rule-robust-exec-001).",
      "trace": {
        "applied_rule_id": "rule-robust-exec-001",
        "applied_rule_version": "1.0.0",
        "claim_id": "claim-954e7456d5577e85",
        "context_pack_id": "ctx-health-001",
        "context_pack_version": "1.0",
        "passport_version": "v2a93800ba119bbfe",
        "role_id": "executive",
        "source_finding_id": "find-robust-001",
        "source_hash": "b7e2f4a1c9d3e5f6",
        "source_method": "projected-gradient adversarial evaluation",
        "source_timestamp": "2025-04-01T08:00:00Z"
      },
      "visible_fields_used": [
        "finding_family"
      ]
    },
    {
      "claim_id": "claim-ccf2e4a75b8cc60c",
      "text": "Field 'severity' has value 'high' (sourced from finding find-robust-001 via rule rule-robust-exec-001).",
      "trace": {
        "applied_rule_id": "rule-robust-exec-001",
        "applied_rule_version": "1.0.0",
        "claim_id": "claim-ccf2e4a75b8cc60c",
        "context_pack_id": "ctx-health-001",
        "context_pack_version": "1.0",
        "passport_version": "v2a93800ba119bbfe",
        "role_id": "executive",
        "source_finding_id": "find-robust-001",
        "source_hash": "b7e2f4a1c9d3e5f6",
        "source_method": "projected-gradient adversarial evaluation",
        "source_timestamp": "2025-04-01T08:00:00Z"
      },
      "visible_fields_used": [
        "severity"
      ]
    }
  ],
  "decision_relevance": "This passport supports the 'halt_programme' decision for role 'executive'. Confidence: 0.83.",
  "expires_at": null,
  "headline": "[HIGH] Robustness finding \u2014 halt_programme (role: executive)",
  "limitations": [],
  "overall_rcea": 0.83125,
  "passport_id": "passport-0e3f56c478999c11",
  "passport_version": "v2a93800ba119bbfe",
  "rcea_scores": {
    "audit_traceability": 1.0,
    "decision_actionability": 1.0,
    "epistemic_warrant": 0.65,
    "interpretive_fit": 1.0,
    "limitation_propagation": 0.0,
    "material_relevance": 1.0,
    "overall": 0.83125
  },
  "regulatory_or_policy_references": [],
  "role_id": "executive",
  "summary": "A high robustness finding requires executive review. Action: halt_programme.",
  "suppressed_fields": [
    "evidence_level",
    "limitations",
    "method",
    "metric",
    "provenance_hash",
    "regulatory_mapping",
    "threshold",
    "uncertainty",
    "value"
  ],
  "suppression_log": [
    {
      "field": "evidence_level",
      "rationale": "Evidence grading suppressed.",
      "retrievable": true,
      "role_id": "executive",
      "rule_id": "rule-robust-exec-001",
      "rule_version": "1.0.0"
    },
    {
      "field": "limitations",
      "rationale": "Limitations deferred.",
      "retrievable": true,
      "role_id": "executive",
      "rule_id": "rule-robust-exec-001",
      "rule_version": "1.0.0"
    },
    {
      "field": "method",
      "rationale": "Methodology suppressed.",
      "retrievable": true,
      "role_id": "executive",
      "rule_id": "rule-robust-exec-001",
      "rule_version": "1.0.0"
    },
    {
      "field": "metric",
      "rationale": "Technical metric suppressed for executive view.",
      "retrievable": true,
      "role_id": "executive",
      "rule_id": "rule-robust-exec-001",
      "rule_version": "1.0.0"
    },
    {
      "field": "provenance_hash",
      "rationale": "Audit hash not relevant.",
      "retrievable": true,
      "role_id": "executive",
      "rule_id": "rule-robust-exec-001",
      "rule_version": "1.0.0"
    },
    {
      "field": "regulatory_mapping",
      "rationale": "Regulatory detail deferred to compliance.",
      "retrievable": true,
      "role_id": "executive",
      "rule_id": "rule-robust-exec-001",
      "rule_version": "1.0.0"
    },
    {
      "field": "threshold",
      "rationale": "Technical threshold suppressed.",
      "retrievable": true,
      "role_id": "executive",
      "rule_id": "rule-robust-exec-001",
      "rule_version": "1.0.0"
    },
    {
      "field": "uncertainty",
      "rationale": "Uncertainty detail deferred.",
      "retrievable": true,
      "role_id": "executive",
      "rule_id": "rule-robust-exec-001",
      "rule_version": "1.0.0"
    },
    {
      "field": "value",
      "rationale": "Raw value suppressed.",
      "retrievable": true,
      "role_id": "executive",
      "rule_id": "rule-robust-exec-001",
      "rule_version": "1.0.0"
    }
  ],
  "uncertainty_statement": "Medium uncertainty; interpret with caution.",
  "visible_fields": {
    "context_tags": [
      "diagnostic-ai",
      "radiology",
      "adversarial",
      "safety-critical"
    ],
    "finding_family": "robustness",
    "severity": "high"
  }
}