{
  "passport_id": "passport-3a4c789ad5ecc565",
  "passport_version": "v00ff37305e5851dc",
  "role_id": "executive",
  "action_label": "require_board_briefing",
  "headline": "[HIGH] Privacy finding \u2014 require_board_briefing (role: executive)",
  "summary": "A high privacy finding has been identified in the executive context. Recommended action: require_board_briefing.",
  "decision_relevance": "This passport supports the 'require_board_briefing' decision for role 'executive'. Confidence: 0.89.",
  "visible_fields": {
    "context_tags": [
      "recruitment",
      "chatbot",
      "pii",
      "gdpr"
    ],
    "finding_family": "privacy",
    "severity": "high"
  },
  "suppressed_fields": [
    "evidence_level",
    "limitations",
    "method",
    "metric",
    "provenance_hash",
    "regulatory_mapping",
    "threshold",
    "uncertainty",
    "value"
  ],
  "suppression_log": [
    {
      "field": "evidence_level",
      "role_id": "executive",
      "rule_id": "rule-priv-exec-001",
      "rule_version": "1.1.0",
      "rationale": "Evidence grading detail not required at executive level.",
      "retrievable": true
    },
    {
      "field": "limitations",
      "role_id": "executive",
      "rule_id": "rule-priv-exec-001",
      "rule_version": "1.1.0",
      "rationale": "Detailed limitations deferred to DPO/AI Lead.",
      "retrievable": true
    },
    {
      "field": "method",
      "role_id": "executive",
      "rule_id": "rule-priv-exec-001",
      "rule_version": "1.1.0",
      "rationale": "Methodology detail suppressed for executive view.",
      "retrievable": true
    },
    {
      "field": "metric",
      "role_id": "executive",
      "rule_id": "rule-priv-exec-001",
      "rule_version": "1.1.0",
      "rationale": "Technical metric not required for executive decision.",
      "retrievable": true
    },
    {
      "field": "provenance_hash",
      "role_id": "executive",
      "rule_id": "rule-priv-exec-001",
      "rule_version": "1.1.0",
      "rationale": "Audit hash not relevant to executive decision.",
      "retrievable": true
    },
    {
      "field": "regulatory_mapping",
      "role_id": "executive",
      "rule_id": "rule-priv-exec-001",
      "rule_version": "1.1.0",
      "rationale": "Regulatory detail deferred to DPO briefing.",
      "retrievable": true
    },
    {
      "field": "threshold",
      "role_id": "executive",
      "rule_id": "rule-priv-exec-001",
      "rule_version": "1.1.0",
      "rationale": "Technical threshold suppressed.",
      "retrievable": true
    },
    {
      "field": "uncertainty",
      "role_id": "executive",
      "rule_id": "rule-priv-exec-001",
      "rule_version": "1.1.0",
      "rationale": "Uncertainty details handled by AI Lead.",
      "retrievable": true
    },
    {
      "field": "value",
      "role_id": "executive",
      "rule_id": "rule-priv-exec-001",
      "rule_version": "1.1.0",
      "rationale": "Raw value suppressed; severity label sufficient.",
      "retrievable": true
    }
  ],
  "limitations": [
    "Material technical limitations apply to this finding; consult DPO and AI Lead for full details before final governance decision."
  ],
  "uncertainty_statement": "Medium uncertainty; interpret with caution.",
  "regulatory_or_policy_references": [],
  "claims": [
    {
      "claim_id": "claim-35b57da2e1c40f08",
      "text": "Field 'context_tags' has value ['recruitment', 'chatbot', 'pii', 'gdpr'] (sourced from finding find-privacy-001 via rule rule-priv-exec-001).",
      "visible_fields_used": [
        "context_tags"
      ],
      "trace": {
        "claim_id": "claim-35b57da2e1c40f08",
        "source_finding_id": "find-privacy-001",
        "source_hash": "a3f1c9e2b7d4e8f0",
        "source_method": "NER + pattern-based PII scan",
        "source_timestamp": "2025-03-15T10:30:00Z",
        "applied_rule_id": "rule-priv-exec-001",
        "applied_rule_version": "1.1.0",
        "context_pack_id": "ctx-recruit-001",
        "context_pack_version": "1.0",
        "role_id": "executive",
        "passport_version": "v00ff37305e5851dc"
      }
    },
    {
      "claim_id": "claim-a85de51322351ac2",
      "text": "Field 'finding_family' has value 'privacy' (sourced from finding find-privacy-001 via rule rule-priv-exec-001).",
      "visible_fields_used": [
        "finding_family"
      ],
      "trace": {
        "claim_id": "claim-a85de51322351ac2",
        "source_finding_id": "find-privacy-001",
        "source_hash": "a3f1c9e2b7d4e8f0",
        "source_method": "NER + pattern-based PII scan",
        "source_timestamp": "2025-03-15T10:30:00Z",
        "applied_rule_id": "rule-priv-exec-001",
        "applied_rule_version": "1.1.0",
        "context_pack_id": "ctx-recruit-001",
        "context_pack_version": "1.0",
        "role_id": "executive",
        "passport_version": "v00ff37305e5851dc"
      }
    },
    {
      "claim_id": "claim-0ad7d933ec59d531",
      "text": "Field 'severity' has value 'high' (sourced from finding find-privacy-001 via rule rule-priv-exec-001).",
      "visible_fields_used": [
        "severity"
      ],
      "trace": {
        "claim_id": "claim-0ad7d933ec59d531",
        "source_finding_id": "find-privacy-001",
        "source_hash": "a3f1c9e2b7d4e8f0",
        "source_method": "NER + pattern-based PII scan",
        "source_timestamp": "2025-03-15T10:30:00Z",
        "applied_rule_id": "rule-priv-exec-001",
        "applied_rule_version": "1.1.0",
        "context_pack_id": "ctx-recruit-001",
        "context_pack_version": "1.0",
        "role_id": "executive",
        "passport_version": "v00ff37305e5851dc"
      }
    }
  ],
  "rcea_scores": {
    "material_relevance": 1.0,
    "epistemic_warrant": 0.65,
    "interpretive_fit": 1.0,
    "decision_actionability": 1.0,
    "limitation_propagation": 0.5,
    "audit_traceability": 1.0,
    "overall": 0.89375
  },
  "overall_rcea": 0.89375,
  "expires_at": null
}
