{
  "action_label": "commission_audit",
  "claims": [
    {
      "claim_id": "claim-255b8f478720455f",
      "text": "Field 'evidence_level' has value 'tested' (sourced from finding find-privacy-001 via rule rule-priv-ai-lead-001).",
      "trace": {
        "applied_rule_id": "rule-priv-ai-lead-001",
        "applied_rule_version": "1.0.0",
        "claim_id": "claim-255b8f478720455f",
        "context_pack_id": "ctx-recruit-001",
        "context_pack_version": "1.0",
        "passport_version": "v15bb2372c124c8d4",
        "role_id": "ai_lead",
        "source_finding_id": "find-privacy-001",
        "source_hash": "a3f1c9e2b7d4e8f0",
        "source_method": "NER + pattern-based PII scan",
        "source_timestamp": "2025-03-15T10:30:00Z"
      },
      "visible_fields_used": [
        "evidence_level"
      ]
    },
    {
      "claim_id": "claim-e0704029ed07afb2",
      "text": "Field 'limitations' has value ['Validated only for English and French; other languages may have undetected PII', 'NER model may miss obfuscated or encoded PII forms'] (sourced from finding find-privacy-001 via rule rule-priv-ai-lead-001).",
      "trace": {
        "applied_rule_id": "rule-priv-ai-lead-001",
        "applied_rule_version": "1.0.0",
        "claim_id": "claim-e0704029ed07afb2",
        "context_pack_id": "ctx-recruit-001",
        "context_pack_version": "1.0",
        "passport_version": "v15bb2372c124c8d4",
        "role_id": "ai_lead",
        "source_finding_id": "find-privacy-001",
        "source_hash": "a3f1c9e2b7d4e8f0",
        "source_method": "NER + pattern-based PII scan",
        "source_timestamp": "2025-03-15T10:30:00Z"
      },
      "visible_fields_used": [
        "limitations"
      ]
    },
    {
      "claim_id": "claim-d741a12599d45aed",
      "text": "Field 'method' has value 'NER + pattern-based PII scan' (sourced from finding find-privacy-001 via rule rule-priv-ai-lead-001).",
      "trace": {
        "applied_rule_id": "rule-priv-ai-lead-001",
        "applied_rule_version": "1.0.0",
        "claim_id": "claim-d741a12599d45aed",
        "context_pack_id": "ctx-recruit-001",
        "context_pack_version": "1.0",
        "passport_version": "v15bb2372c124c8d4",
        "role_id": "ai_lead",
        "source_finding_id": "find-privacy-001",
        "source_hash": "a3f1c9e2b7d4e8f0",
        "source_method": "NER + pattern-based PII scan",
        "source_timestamp": "2025-03-15T10:30:00Z"
      },
      "visible_fields_used": [
        "method"
      ]
    },
    {
      "claim_id": "claim-9aac83a704d6dc0a",
      "text": "Field 'metric' has value 'pii_entity_count' (sourced from finding find-privacy-001 via rule rule-priv-ai-lead-001).",
      "trace": {
        "applied_rule_id": "rule-priv-ai-lead-001",
        "applied_rule_version": "1.0.0",
        "claim_id": "claim-9aac83a704d6dc0a",
        "context_pack_id": "ctx-recruit-001",
        "context_pack_version": "1.0",
        "passport_version": "v15bb2372c124c8d4",
        "role_id": "ai_lead",
        "source_finding_id": "find-privacy-001",
        "source_hash": "a3f1c9e2b7d4e8f0",
        "source_method": "NER + pattern-based PII scan",
        "source_timestamp": "2025-03-15T10:30:00Z"
      },
      "visible_fields_used": [
        "metric"
      ]
    },
    {
      "claim_id": "claim-4c008dd775d2c185",
      "text": "Field 'threshold' has value 0 (sourced from finding find-privacy-001 via rule rule-priv-ai-lead-001).",
      "trace": {
        "applied_rule_id": "rule-priv-ai-lead-001",
        "applied_rule_version": "1.0.0",
        "claim_id": "claim-4c008dd775d2c185",
        "context_pack_id": "ctx-recruit-001",
        "context_pack_version": "1.0",
        "passport_version": "v15bb2372c124c8d4",
        "role_id": "ai_lead",
        "source_finding_id": "find-privacy-001",
        "source_hash": "a3f1c9e2b7d4e8f0",
        "source_method": "NER + pattern-based PII scan",
        "source_timestamp": "2025-03-15T10:30:00Z"
      },
      "visible_fields_used": [
        "threshold"
      ]
    },
    {
      "claim_id": "claim-db58fad7665ebc0d",
      "text": "Field 'uncertainty' has value 'medium' (sourced from finding find-privacy-001 via rule rule-priv-ai-lead-001).",
      "trace": {
        "applied_rule_id": "rule-priv-ai-lead-001",
        "applied_rule_version": "1.0.0",
        "claim_id": "claim-db58fad7665ebc0d",
        "context_pack_id": "ctx-recruit-001",
        "context_pack_version": "1.0",
        "passport_version": "v15bb2372c124c8d4",
        "role_id": "ai_lead",
        "source_finding_id": "find-privacy-001",
        "source_hash": "a3f1c9e2b7d4e8f0",
        "source_method": "NER + pattern-based PII scan",
        "source_timestamp": "2025-03-15T10:30:00Z"
      },
      "visible_fields_used": [
        "uncertainty"
      ]
    },
    {
      "claim_id": "claim-28c60750168a04d6",
      "text": "Field 'value' has value 14 (sourced from finding find-privacy-001 via rule rule-priv-ai-lead-001).",
      "trace": {
        "applied_rule_id": "rule-priv-ai-lead-001",
        "applied_rule_version": "1.0.0",
        "claim_id": "claim-28c60750168a04d6",
        "context_pack_id": "ctx-recruit-001",
        "context_pack_version": "1.0",
        "passport_version": "v15bb2372c124c8d4",
        "role_id": "ai_lead",
        "source_finding_id": "find-privacy-001",
        "source_hash": "a3f1c9e2b7d4e8f0",
        "source_method": "NER + pattern-based PII scan",
        "source_timestamp": "2025-03-15T10:30:00Z"
      },
      "visible_fields_used": [
        "value"
      ]
    }
  ],
  "decision_relevance": "This passport supports the 'commission_audit' decision for role 'ai_lead'. Confidence: 0.90.",
  "expires_at": null,
  "headline": "[HIGH] Privacy finding \u2014 commission_audit (role: ai_lead)",
  "limitations": [
    "Validated only for English and French; other languages may have undetected PII",
    "NER model may miss obfuscated or encoded PII forms"
  ],
  "overall_rcea": 0.9027777777777778,
  "passport_id": "passport-7b356a32f87830e9",
  "passport_version": "v15bb2372c124c8d4",
  "rcea_scores": {
    "audit_traceability": 1.0,
    "decision_actionability": 1.0,
    "epistemic_warrant": 0.65,
    "interpretive_fit": 1.0,
    "limitation_propagation": 1.0,
    "material_relevance": 1.0,
    "overall": 0.9027777777777778
  },
  "regulatory_or_policy_references": [],
  "role_id": "ai_lead",
  "summary": "Finding: pii_entity_count=14 (threshold: 0) via NER + pattern-based PII scan. Uncertainty: medium. Recommended: commission_audit.",
  "suppressed_fields": [
    "context_tags",
    "provenance_hash",
    "regulatory_mapping",
    "severity"
  ],
  "suppression_log": [
    {
      "field": "context_tags",
      "rationale": "Internal classification tags.",
      "retrievable": true,
      "role_id": "ai_lead",
      "rule_id": "rule-priv-ai-lead-001",
      "rule_version": "1.0.0"
    },
    {
      "field": "provenance_hash",
      "rationale": "Hash stored in audit log; not needed for model remediation decision.",
      "retrievable": true,
      "role_id": "ai_lead",
      "rule_id": "rule-priv-ai-lead-001",
      "rule_version": "1.0.0"
    },
    {
      "field": "regulatory_mapping",
      "rationale": "Regulatory mapping handled by DPO; not within AI lead scope for this view.",
      "retrievable": true,
      "role_id": "ai_lead",
      "rule_id": "rule-priv-ai-lead-001",
      "rule_version": "1.0.0"
    },
    {
      "field": "severity",
      "rationale": "Severity label suppressed to avoid anchoring; AI lead should interpret raw metric.",
      "retrievable": true,
      "role_id": "ai_lead",
      "rule_id": "rule-priv-ai-lead-001",
      "rule_version": "1.0.0"
    }
  ],
  "uncertainty_statement": "Medium uncertainty; interpret with caution.",
  "visible_fields": {
    "evidence_level": "tested",
    "limitations": [
      "Validated only for English and French; other languages may have undetected PII",
      "NER model may miss obfuscated or encoded PII forms"
    ],
    "method": "NER + pattern-based PII scan",
    "metric": "pii_entity_count",
    "threshold": 0,
    "uncertainty": "medium",
    "value": 14
  }
}